<?xml version="1.0" encoding="UTF-8"?>
<!DOCTYPE scheduler PUBLIC
  "-//Penrose/DTD Scheduler ${product.specification}//EN"
  "http://penrose.safehaus.org/dtd/scheduler.dtd">

<scheduler enabled="true">

  <scheduler-class>org.safehaus.penrose.scheduler.quartz.QuartzScheduler</scheduler-class>

  <job name="LockoutJob">
    <job-class>org.safehaus.penrose.lockout.LockoutJob</job-class>
  </job>

  <trigger>
    <trigger-class>org.safehaus.penrose.scheduler.quartz.CronTrigger</trigger-class>
    <job-name>LockoutJob</job-name>
    <parameter>
      <param-name>expression</param-name>
      <param-value>0 * * * * ?</param-value>
    </parameter>
  </trigger>

</scheduler>
